id,answers,score
9, هود هو الذي بعثه الله ليكون نبياً لقوم عاد,2
9,هود  كان رسولاً لقوم عاد,2
9,هود  عليه السلام هو النبي الذي بعثه الله لقوم عاد,2
9,الرسول  هود هو الذي أُرسل لينذر قوم عاد,2
9,هود الرسول الذي بعثه الله ليحذر قوم عاد,2
9,هود كان النبي الذي أرسله الله لقوم عاد لدعوتهم إلى الطريق الصواب.,2
9, الرسول هود هو الذي بعثه الله لتوجيه قوم عاد,2
9,هود  هو الرسول الذي بعثه الله للتنبيه على قوم عاد,2
9,هود عليه السلام النبي الذي بعثه الله لينذر قوم عاد,2
9,هود  كان رسول الله لقوم عاد.,2
9,النبي  هود هو الذي بعثه الله لدعوة قوم عاد,2
9,هود  الرسول الذي أرسله الله لينذر قوم عاد بعذابه,2
9,هود  كان من بين الأنبياء الذين بعثهم الله لقوم عاد,2
9,النبي  هود كان رسولاً مُرسلاً لقوم عاد,2
9,هود  هو الذي أُرسل لقوم عاد ليرشدهم,2
9,الرسول  هود هو الذي بعثه الله ليصحح مسار قوم عاد,2
9,هود عليه السلام الرسول الذي بعثه الله لتنبيه قوم عاد,2
9,هود  هو النبي الذي أُرسل ليحذر قوم عاد من عذاب الله,2
9,النبي  هود هو الرسول الذي أُرسل لينذر قوم عاد,2
9,هود  كان رسول الله لقوم عاد لدعوتهم إلى الحق,2
9,هود عليه السلام كان الرسول الذي بعثه الله لتوجيه قوم عاد,2
9,النبي  هود هو الذي بعثه الله لينذر قوم عاد بالعقاب,2
9,هود  الرسول الذي أُرسل لقوم عاد لتحذيرهم,2
9,هود  هو النبي الذي بعثه الله لتوجيه قوم عاد.,2
9,اارسول  هود كان الذي بعثه الله لينذر قوم عاد.,2
9,هود  عليه السلام النبي الذي بعثه الله لتحذير قوم عاد,2
9,النبي هود هو الذي بعثه الله لتوجيه قوم عاد إلى الطريق المستقيم,2
9,هود  كان رسول الله لقوم عاد ليرشدهم للحق,2
9,الرسول هود هو الذي بعثه الله ليحذر قوم عاد من عذابه,2
9,هود عليه السلام كان النبي الذي بعثه الله لتنبيه قوم عاد,2
9,هود عليه السلام الرسول الذي بعثه الله لتنبيه قوم عاد بعقابه.,2
9,هود هو النبي الذي بعثه الله ليحث قوم عاد على العودة إلى الله,2
9,الرسول هود هو الذي بعثه الله لينذر قوم عاد من الضلال,2
9, النبي هود هو الذي بعثه الله ليوجه قوم عاد للطريق الصحيح,2
9,هود عليه السلام كان الرسول الذي بعثه الله لينذر قوم عاد بعذابه,2
9,النبي المرسل الى قوم عاد هو محمد,0
9,تلنبي المرسل الى قوم عاد هو موسى عليه السلام,0
9,موسى هو النبي المرسل لقوم عاد ,0
9,النبي المرسل هو عيسى ,0
9,الجواب هو النبي عيسى ,0
9,عيسى ,0
9,النبي موسى هو الذي كان مرسل لقوم عاد,0
9, محمد هو الذي بعثه الله ليكون نبياً لقوم عاد.,0
9,ابراهيم عليه السلام ,0
9,لا أعرف الجواب,0
9,ابراهم هو النبي المرسل,0
9,الرسول ابراهيم عليه أفضل الصلاة و السلام ,0
9,الرسول ابراهيم,0
9,الجواب هو النبي عيسى عليه السلام  ,0
9,لا أعرف جواب هاذا السؤال ,0
9,عيسى هو النبي المرسل إلى قوم عاد,0
9,عيسى كان رسولا لقوم عاد,0
9,النبي عيسى  كان رسولا مُرسلا لقوم عاد,0
9,ابراهيم,0
9, عيسى هو النبي المرسل لقوم عاد,0
9,عيسى هو  الرسول الذي بعثه الله ليحذر قوم عاد,0
9,عيسى هو الذي أُرسل لقوم عاد ليرشدهم,0
9,الرسول عيسى كان الذي بعثه الله لينذر قوم عاد,0
9,الرسول عيسى هو الذي بعثه الله لينذر قوم عاد من الضلال.,0
9,هود عليه السلام,2
9,هود ,2
9,هود ,2
9,ابراهيم,0
9,النبي المرسل لقوم عاد هو ,0
9,محمد هو النبي المرسل الى قوم عاد ,0
9,الجواب هو اسماعيل,0
9,النبي موسى عليه السلام,0
10,رسل الله النبي صالح إلى قوم ثمود,2
10,أرسل النبي صالح لدعوة قوم ثمود إلى الطريق الصالح,2
10,الله أرسل النبي صالح ليهدي قوم ثمود,2
10,أرسل النبي صالح رسالة الإسلام إلى قوم ثمود,2
10,النبي صالح بعثه الله لدعوة قوم ثمود إلى الإيمان والصلاح,2
10,الله أرسل النبي صالح كنذيراً لقوم ثمود,2
10,صالح كان رسولاً أرسله الله إلى قوم ثمود,2
10,الله أمر النبي صالح ببلوغ رسالته إلى قوم ثمود,2
10,قوم ثمود أرسل الله إليهم النبي صالح ليصحح طريقهم,2
10,النبي صالح أرسله الله بالهداية لقوم ثمود,2
10,الله بعث النبي صالح رحمة لقوم ثمود,2
10,الله أرسل النبي صالح بالإرشاد لقوم ثمود,2
10,قوم ثمود كانت هدفًا لدعوة النبي صالح من الله,2
10,الله أرسل النبي صالح كنذيرًا لقوم ثمود,2
10,الله أمر النبي صالح بنشر رسالته بين قوم ثمود,2
10,الله أمر النبي صالح بنشر رسالته بين قوم ثمود,2
10,النبي صالح أُرسل لينقذ قوم ثمود من الضلال,2
10,قوم ثمود كانوا مستهدفين بدعوة النبي صالح,2
10,النبي صالح أُرسله الله ليهدي قوم ثمود,2
10,الله أرسل رسوله صالح ليدعو قوم ثمود إلى الخير,2
10,صالح كان نبيًا أُرسله الله لدعوة قوم ثمود,2
10,النبي صالح أُرسله الله لتصحيح عقيدة قوم ثمود,2
10,الله أرسل النبي صالح لإصلاح دين قوم ثمود,2
10,النبي صالح مرسول الله إلى قوم ثمود,2
10,الله أرسل النبي صالح ليبلغ دعوته إلى قوم ثمود,2
10,قوم ثمود كان الهدف الرئيسي لدعوة النبي صالح,2
10,الله أمر النبي صالح بدعوة قوم ثمود للهداية,2
10,الله أرسل رسالة النبي صالح لقوم ثمود,2
10,النبي صالح كان رسولًا من الله إلى قوم ثمود,2
10,الله أمر النبي صالح بدعوة قوم ثمود إلى الحق,2
10,صالح بعثه الله رحمة لقوم ثمود,2
10,الله أرسل النبي صالح كدليل لقوم ثمود,2
10,النبي صالح أرسله الله ليصلح دين قوم ثمود,2
10,الله أمر النبي صالح بالبلاغ لقوم ثمود,2
10,صالح كان نبيًا من الله لقوم ثمود,2
10,الله أرسل النبي صالح لينذر قوم ثمود,2
10,النبي صالح أُرسل ليهدي قوم ثمود إلى الحق,2
10,الله أمر النبي صالح بنشر دينه بين قوم ثمود,2
10,صالح أُرسله الله كنذير لقوم ثمود,2
10,الله أرسل النبي صالح برسالته لقوم ثمود,2
10,النبي صالح أرسله الله لتوجيه قوم ثمود,2
10,الله أرسل النبي صالح للدعوة إلى الصواب لقوم ثمود,2
10,قوم ثمود أرسل الله إليهم النبي صالح للإرشاد,2
10,الله أمر النبي صالح بالدعوة لقوم ثمود,2
10,النبي صالح أُرسل للإصلاح بين قوم ثمود,2
10,الله أرسل النبي صالح بالهداية لقوم ثمود,2
10,ثمود,2
10,قوم ثمود,2
10,الله أوجد النبي صالح ليوجه قوم ثمود نحو الخير,2
10,النبي صالح أُرسل ليوجه دعوته نحو قوم ثمود,2
10,النبي صالح كان رسولًا ليوجه قوم ثمود,2
10,النبي صالح أُرسله الله ليهدي قوم ثمود للصواب,2
10,صالح كان رسولًا من الله لقوم ثمود,2
10,النبي صالح أُرسله الله ليبلغ دعوته لقوم ثمود,2
10,الله أمر النبي صالح بتوجيه رسالته لقوم ثمود,2
10,الله أمر النبي صالح بالبلاغ لقوم ثمود,2
10,الله أرسل النبي صالح لتصحيح عقيدة قوم ثمود,2
10,الله أمر النبي صالح بالتبليغ لقوم ثمود,2
10,النبي صالح أُرسله الله بدعوته للإصلاح بين قوم ثمود,2
10,النبي صالح أُرسله الله بدعوته للإصلاح بين قوم ثمود,2
10,الله أمر النبي صالح بدعوة قوم ثمود للإيمان,2
10,الله أرسل النبي صالح ليوجه دعوته لقوم ثمود,2
10,صالح كان رسولًا من الله للتوجيه لقوم ثمود,2
10,صالح كان رسولًا من الله للتوجيه لقوم ثمود,2
10,الله بعث النبي صالح لإرشاد قوم ثمود للخير,2
10,النبي صالح أُرسله الله بدعوته للإصلاح بين قوم ثمود,2
10,صالح كان نبيًا أُرسله الله للتوجيه لقوم ثمود,2
10,قوم ثمود,2
10,قوم ثمود,2
10,قوم ثمود,2
10, ثمود,2
10,قوم ثمود,2
10, قوم عاد,0
10, قوم عاد,0
10, عاد,0
10,قوم لوط,0
10,أرسل النبي صالح إلى قوم ثمود,2
10,أرسل النبي صالح إلى قوم لوط,0
10,لنبي صالح أُرسل ليوجه دعوته نحو قوم لوط,0
10,أرسل النبي صالح إلى قوم,0
10,نبي صالح أرسل لقوم ثمود.,2
10,نبي صالح أرسل لقوم  لوط,0
10,لقوم ثمود أُرسل النبي صالح,2
10,لقوم عاد أُرسل النبي صالح ,0
10,دعا صالح قوم ثمود,2
10,دعا صالح قوم  لوط,0
10,لى قوم ثمود دعا النبي صالح,2
10,لى قوم لوط دعا النبي صالح,0
10,نبي صالح بعثه الله إلى قوم ثمود,2
10,نبي صالح بعثه الله إلى قوم  لوط,0
10,نبي صالح دُعي للدعوة لقومه,0
10,النبي صالح أُرسل إلى الثموديين,2
10,لا أعرف الجواب,0
10,لا أعرف,0
10,لا أعلم,0
10, لوط,0
10, ثمود ,2
10, ثمود,2
10, ثمود,2
10,قوم لوط,0
